{
  "$schema": "https://json-schema.org/draft/2020-12/schema",
  "$id": "https://raw.githubusercontent.com/simplifica-if/base-conhecimento/main/schemas/campus.schema.json",
  "title": "Campus do IFPR",
  "type": "object",
  "required": [
    "id",
    "nome",
    "links",
    "cursos"
  ],
  "additionalProperties": false,
  "properties": {
    "id": {
      "type": "string",
      "pattern": "^[a-z0-9]+(?:-[a-z0-9]+)*$"
    },
    "nome": {
      "type": "string",
      "minLength": 1
    },
    "links": {
      "type": "object",
      "required": [
        "site",
        "calendario_academico"
      ],
      "additionalProperties": {
        "type": "string",
        "format": "uri",
        "pattern": "^https://"
      },
      "properties": {
        "site": {
          "type": "string",
          "format": "uri",
          "pattern": "^https://"
        },
        "calendario_academico": {
          "type": "string",
          "format": "uri",
          "pattern": "^https://"
        }
      }
    },
    "horario_aulas": {
      "type": "object",
      "required": [
        "coletado_em",
        "status_curadoria"
      ],
      "additionalProperties": false,
      "properties": {
        "url": {
          "type": "string",
          "format": "uri",
          "pattern": "^https://"
        },
        "titulo_fonte": {
          "type": "string",
          "minLength": 1
        },
        "coletado_em": {
          "type": "string",
          "pattern": "^\\d{4}-\\d{2}-\\d{2}T\\d{2}:\\d{2}:\\d{2}(?:Z|[+-]\\d{2}:\\d{2})$"
        },
        "periodo_referencia": {
          "type": "string",
          "minLength": 1
        },
        "tipo_fonte": {
          "enum": [
            "pagina_ifpr",
            "google_sheets",
            "edupage",
            "app_externo"
          ]
        },
        "status_curadoria": {
          "enum": [
            "revisado",
            "parcial",
            "nao_encontrado"
          ]
        },
        "observacoes": {
          "type": "string",
          "minLength": 1
        }
      }
    },
    "cursos": {
      "type": "array",
      "items": {
        "type": "object",
        "required": [
          "id",
          "notion_page_id",
          "nome",
          "nivel",
          "tipo_oferta",
          "url"
        ],
        "additionalProperties": false,
        "properties": {
          "id": {
            "type": "string",
            "pattern": "^[a-z0-9]+(?:-[a-z0-9]+)*$"
          },
          "notion_page_id": {
            "type": "string",
            "pattern": "^[0-9a-f]{8}-[0-9a-f]{4}-[0-9a-f]{4}-[0-9a-f]{4}-[0-9a-f]{12}$"
          },
          "nome": {
            "type": "string",
            "minLength": 1
          },
          "nivel": {
            "enum": [
              "fundamental",
              "médio",
              "superior",
              "pós-graduação",
              "formação inicial e continuada"
            ]
          },
          "tipo_oferta": {
            "enum": [
              "técnico integrado",
              "técnico subsequente",
              "graduação tecnológica",
              "bacharelado",
              "licenciatura",
              "especialização",
              "mestrado",
              "FIC",
              "programa institucional"
            ]
          },
          "modalidade": {
            "enum": [
              "presencial",
              "ead",
              "semipresencial"
            ]
          },
          "situacao": {
            "enum": [
              "abertura",
              "ativo",
              "em_oferta",
              "suspenso",
              "incerto"
            ]
          },
          "escopo": {
            "enum": [
              "campus",
              "rede",
              "programa",
              "polo"
            ]
          },
          "url": {
            "type": "string",
            "format": "uri",
            "pattern": "^https://"
          },
          "suap": {
            "type": "object",
            "required": [
              "notion_page_id"
            ],
            "minProperties": 1,
            "additionalProperties": false,
            "properties": {
              "notion_page_id": {
                "type": "string",
                "pattern": "^[0-9a-f]{8}-[0-9a-f]{4}-[0-9a-f]{4}-[0-9a-f]{4}-[0-9a-f]{12}$"
              },
              "id": {
                "type": "integer",
                "minimum": 1
              },
              "codigo": {
                "type": "string",
                "minLength": 1
              },
              "vagas": {
                "type": "integer",
                "minimum": 0
              }
            }
          },
          "sei": {
            "type": "object",
            "required": [
              "processos"
            ],
            "additionalProperties": false,
            "properties": {
              "processos": {
                "type": "array",
                "minItems": 1,
                "items": {
                  "type": "object",
                  "required": [
                    "numero",
                    "tipo"
                  ],
                  "additionalProperties": false,
                  "properties": {
                    "numero": {
                      "type": "string",
                      "pattern": "^\\d{5}\\.\\d{6}/\\d{4}-\\d{2}$"
                    },
                    "tipo": {
                      "enum": [
                        "abertura",
                        "ajuste",
                        "atualização",
                        "suspensão",
                        "reversão de suspensão",
                        "extinção",
                        "outro"
                      ]
                    },
                    "trecho_fonte": {
                      "type": "string",
                      "minLength": 1
                    },
                    "status_curadoria": {
                      "enum": [
                        "precisa_revisao",
                        "revisado",
                        "inconsistente",
                        "pendente"
                      ]
                    },
                    "revisado_em": {
                      "type": "string",
                      "format": "date"
                    }
                  }
                }
              }
            }
          },
          "ppc": {
            "type": "object",
            "required": [
              "notion_page_id",
              "url",
              "conversao"
            ],
            "additionalProperties": false,
            "properties": {
              "notion_page_id": {
                "type": "string",
                "pattern": "^[0-9a-f]{8}-[0-9a-f]{4}-[0-9a-f]{4}-[0-9a-f]{4}-[0-9a-f]{12}$"
              },
              "url": {
                "type": "string",
                "format": "uri",
                "pattern": "^https://"
              },
              "markdown_path": {
                "type": "string",
                "pattern": "^institucional/ifpr/ppcs/[a-z0-9]+(?:-[a-z0-9]+)*/[a-z0-9]+(?:-[a-z0-9]+)*\\.md$"
              },
              "conversao": {
                "type": "object",
                "required": [
                  "status"
                ],
                "additionalProperties": false,
                "properties": {
                  "ferramenta": {
                    "type": "string",
                    "minLength": 1
                  },
                  "versao_ferramenta": {
                    "type": "string",
                    "minLength": 1
                  },
                  "convertido_em": {
                    "type": "string",
                    "format": "date"
                  },
                  "mensagem_erro": {
                    "type": "string",
                    "minLength": 1
                  },
                  "status": {
                    "enum": [
                      "pendente",
                      "convertido",
                      "erro"
                    ]
                  }
                }
              },
              "metadados": {
                "type": "object",
                "additionalProperties": false,
                "properties": {
                  "ano_documento": {
                    "type": "object",
                    "required": [
                      "ano",
                      "trecho_fonte",
                      "status_curadoria"
                    ],
                    "additionalProperties": false,
                    "properties": {
                      "ano": {
                        "type": "integer",
                        "minimum": 1900
                      },
                      "trecho_fonte": {
                        "type": "string",
                        "minLength": 1
                      },
                      "secao": {
                        "type": "string",
                        "minLength": 1
                      },
                      "status_curadoria": {
                        "enum": [
                          "precisa_revisao",
                          "revisado",
                          "inconsistente",
                          "pendente"
                        ]
                      },
                      "revisado_em": {
                        "type": "string",
                        "format": "date"
                      }
                    }
                  },
                  "vagas": {
                    "type": "object",
                    "required": [
                      "quantidade",
                      "trecho_fonte",
                      "status_curadoria"
                    ],
                    "additionalProperties": false,
                    "properties": {
                      "quantidade": {
                        "type": "integer",
                        "minimum": 0
                      },
                      "minimo": {
                        "type": "integer",
                        "minimum": 0
                      },
                      "maximo": {
                        "type": "integer",
                        "minimum": 0
                      },
                      "periodicidade": {
                        "type": "string",
                        "minLength": 1
                      },
                      "turno": {
                        "type": "string",
                        "minLength": 1
                      },
                      "forma_oferta": {
                        "type": "string",
                        "minLength": 1
                      },
                      "trecho_fonte": {
                        "type": "string",
                        "minLength": 1
                      },
                      "pagina": {
                        "type": "integer",
                        "minimum": 1
                      },
                      "secao": {
                        "type": "string",
                        "minLength": 1
                      },
                      "status_curadoria": {
                        "enum": [
                          "precisa_revisao",
                          "revisado",
                          "inconsistente",
                          "pendente"
                        ]
                      },
                      "revisado_em": {
                        "type": "string",
                        "format": "date"
                      }
                    }
                  }
                }
              }
            }
          }
        }
      }
    },
    "programas": {
      "type": "array",
      "items": {
        "type": "object",
        "required": [
          "id",
          "nome",
          "tipo",
          "url",
          "ofertas"
        ],
        "additionalProperties": false,
        "properties": {
          "id": {
            "type": "string",
            "pattern": "^[a-z0-9]+(?:-[a-z0-9]+)*$"
          },
          "nome": {
            "type": "string",
            "minLength": 1
          },
          "tipo": {
            "enum": [
              "programa institucional"
            ]
          },
          "url": {
            "type": "string",
            "format": "uri",
            "pattern": "^https://"
          },
          "ofertas": {
            "type": "array",
            "items": {
              "type": "object",
              "required": [
                "id",
                "nome",
                "nivel",
                "tipo_oferta",
                "modalidade",
                "situacao",
                "escopo",
                "url"
              ],
              "additionalProperties": false,
              "properties": {
                "id": {
                  "type": "string",
                  "pattern": "^[a-z0-9]+(?:-[a-z0-9]+)*$"
                },
                "nome": {
                  "type": "string",
                  "minLength": 1
                },
                "nivel": {
                  "enum": [
                    "fundamental",
                    "médio",
                    "superior",
                    "pós-graduação",
                    "formação inicial e continuada"
                  ]
                },
                "tipo_oferta": {
                  "enum": [
                    "técnico integrado",
                    "técnico subsequente",
                    "graduação tecnológica",
                    "bacharelado",
                    "licenciatura",
                    "especialização",
                    "mestrado",
                    "FIC"
                  ]
                },
                "modalidade": {
                  "enum": [
                    "presencial",
                    "ead",
                    "semipresencial"
                  ]
                },
                "situacao": {
                  "enum": [
                    "ativo",
                    "em_oferta",
                    "suspenso",
                    "incerto"
                  ]
                },
                "escopo": {
                  "enum": [
                    "campus",
                    "rede",
                    "programa",
                    "polo"
                  ]
                },
                "url": {
                  "type": "string",
                  "format": "uri",
                  "pattern": "^https://"
                }
              }
            }
          }
        }
      }
    }
  }
}
