{
  "id": "pinhais",
  "nome": "Pinhais",
  "links": {
    "site": "https://ifpr.edu.br/pinhais/",
    "calendario_academico": "https://ifpr.edu.br/pinhais/institucional/area-do-aluno/calendario-academico/"
  },
  "horario_aulas": {
    "coletado_em": "2026-05-14T11:48:00-03:00",
    "status_curadoria": "revisado",
    "url": "https://ifpr.edu.br/pinhais/institucional/area-do-aluno/horario-de-aulas-e-atendimento/",
    "titulo_fonte": "Horário de aulas e atendimento",
    "tipo_fonte": "pagina_ifpr"
  },
  "cursos": [
    {
      "id": "bacharelado-em-administracao",
      "notion_page_id": "367f5b13-1dbd-81c7-80fb-d3a542f70536",
      "nome": "Bacharelado em Administração",
      "nivel": "superior",
      "tipo_oferta": "bacharelado",
      "url": "https://ifpr.edu.br/pinhais/institucional/nossos-cursos/cursos-superiores/bacharelado-em-administracao/",
      "modalidade": "presencial",
      "situacao": "ativo",
      "escopo": "campus",
      "ppc": {
        "notion_page_id": "367f5b13-1dbd-812e-997e-da37d453bcc6",
        "url": "https://ifpr.edu.br/pinhais/wp-content/uploads/sites/22/2025/12/PPC-Bac.-Administracao-Alterado-2025-Pos-CONSEPE.pdf",
        "conversao": {
          "status": "convertido"
        },
        "markdown_path": "institucional/ifpr/ppcs/pinhais/bacharelado-em-administracao.md",
        "metadados": {
          "ano_documento": {
            "ano": 2025,
            "trecho_fonte": "Ano do documento registrado no Notion: 2025",
            "status_curadoria": "precisa_revisao"
          }
        }
      }
    },
    {
      "id": "bacharelado-em-ciencia-da-computacao",
      "notion_page_id": "367f5b13-1dbd-81f3-aaf2-f437107a795a",
      "nome": "Bacharelado em Ciência da Computação",
      "nivel": "superior",
      "tipo_oferta": "bacharelado",
      "url": "https://ifpr.edu.br/pinhais/institucional/nossos-cursos/cursos-superiores/bacharelado-em-ciencia-da-computacao/",
      "modalidade": "presencial",
      "situacao": "ativo",
      "escopo": "campus",
      "ppc": {
        "notion_page_id": "367f5b13-1dbd-81a5-90c2-c5bfacad23e6",
        "url": "https://ifpr.edu.br/pinhais/wp-content/uploads/sites/22/2026/04/PPC-BCC-2027.pdf",
        "conversao": {
          "status": "convertido"
        },
        "markdown_path": "institucional/ifpr/ppcs/pinhais/bacharelado-em-ciencia-da-computacao.md",
        "metadados": {
          "ano_documento": {
            "ano": 2021,
            "trecho_fonte": "Ano do documento registrado no Notion: 2021",
            "status_curadoria": "precisa_revisao"
          },
          "vagas": {
            "quantidade": 40,
            "trecho_fonte": "Vagas totais (anual) 40 vagas",
            "status_curadoria": "precisa_revisao",
            "periodicidade": "anual"
          }
        }
      }
    },
    {
      "id": "tecnico-em-administracao-integrado-ao-ensino-medio",
      "notion_page_id": "367f5b13-1dbd-8197-bc28-efb0534185e0",
      "nome": "Técnico em Administração",
      "nivel": "médio",
      "tipo_oferta": "técnico integrado",
      "url": "https://ifpr.edu.br/pinhais/institucional/nossos-cursos/tecnicos-integrados/administracao/",
      "modalidade": "presencial",
      "situacao": "ativo",
      "escopo": "campus",
      "suap": {
        "notion_page_id": "36bf5b13-1dbd-812c-bdfd-eaa9dfbb6d40",
        "id": 195,
        "codigo": "PIN001",
        "vagas": 40
      },
      "ppc": {
        "notion_page_id": "367f5b13-1dbd-81b2-a0c7-c304034f3acb",
        "url": "https://ifpr.edu.br/pinhais/wp-content/uploads/sites/22/2025/05/Projeto_Pedagogico_de_Curso_3530515_PPC_ADM_2025_aprovadoCONSEPE.pdf",
        "conversao": {
          "status": "convertido"
        },
        "markdown_path": "institucional/ifpr/ppcs/pinhais/tecnico-em-administracao-integrado-ao-ensino-medio.md",
        "metadados": {
          "ano_documento": {
            "ano": 2025,
            "trecho_fonte": "Ano do documento registrado no Notion: 2025",
            "status_curadoria": "precisa_revisao"
          },
          "vagas": {
            "quantidade": 20,
            "trecho_fonte": "Vagas totais: número mínimo de vagas por turno: 20 vagas de ingresso; número máximo de vagas por turno: 40 vagas de ingresso; número máximo de vagas: 80 vagas de ingresso",
            "status_curadoria": "precisa_revisao"
          }
        }
      },
      "sei": {
        "processos": [
          {
            "numero": "23411.015189/2024-84",
            "tipo": "ajuste",
            "trecho_fonte": "Revisado em 26/05/26 via sei-cli. Origem: https://docs.google.com/spreadsheets/d/1ZyZkQIWHRlaMyiYj9RbO1UofhgZJTmZuMZtr2kMTs2A/edit?gid=732417574#gid=732417574, aba TAREFAS e ATIVIDADES, linha 75. 23/06 - Procedimentos finais - processo enviado para DGA, DIEPI e DIEPEX Pinhais, conforme Portaria 121/2024.\nProcesso finalizado na unidade Dentec."
          }
        ]
      }
    },
    {
      "id": "tecnico-em-informatica-integrado-ao-ensino-medio",
      "notion_page_id": "367f5b13-1dbd-810a-b0e9-cb0d6dc5fd8b",
      "nome": "Técnico em Informática",
      "nivel": "médio",
      "tipo_oferta": "técnico integrado",
      "url": "https://ifpr.edu.br/pinhais/institucional/nossos-cursos/tecnicos-integrados/informatica/",
      "modalidade": "presencial",
      "situacao": "ativo",
      "escopo": "campus",
      "suap": {
        "notion_page_id": "36bf5b13-1dbd-8183-be9f-eff4d3ed7f28",
        "id": 574,
        "codigo": "PIN003",
        "vagas": 80
      },
      "ppc": {
        "notion_page_id": "367f5b13-1dbd-81e0-b32c-dfd4a8c3c0f7",
        "url": "https://ifpr.edu.br/pinhais/wp-content/uploads/sites/22/2025/04/PPC_Informatica_Integrado_EnsinoMedio_2019.pdf",
        "conversao": {
          "status": "convertido"
        },
        "markdown_path": "institucional/ifpr/ppcs/pinhais/tecnico-em-informatica-integrado-ao-ensino-medio.md",
        "metadados": {
          "ano_documento": {
            "ano": 2014,
            "trecho_fonte": "Ano do documento registrado no Notion: 2014",
            "status_curadoria": "precisa_revisao"
          },
          "vagas": {
            "quantidade": 40,
            "trecho_fonte": "Número máximo de vagas do curso: 40 Número mínimo de vagas do curso: 20",
            "status_curadoria": "precisa_revisao",
            "minimo": 20,
            "maximo": 40
          }
        }
      },
      "sei": {
        "processos": [
          {
            "numero": "23411.010854/2023-62",
            "tipo": "ajuste",
            "trecho_fonte": "Revisado em 26/05/26 via sei-cli. Origem: https://docs.google.com/spreadsheets/d/1ZyZkQIWHRlaMyiYj9RbO1UofhgZJTmZuMZtr2kMTs2A/edit?gid=732417574#gid=732417574, aba TAREFAS e ATIVIDADES, linha 74. 09/05 - Procedimentos finais - processo enviado para DGA, DIEPI e DIEPEX Pinhais, conforme Portaria 121/2024.\nProcesso finalizado na unidade Dentec."
          }
        ]
      }
    },
    {
      "id": "tecnologia-em-gestao-da-tecnologia-da-informacao",
      "notion_page_id": "367f5b13-1dbd-81cd-9d9e-d4cb516c33c8",
      "nome": "Tecnologia em Gestão da Tecnologia da Informação",
      "nivel": "superior",
      "tipo_oferta": "graduação tecnológica",
      "url": "https://ifpr.edu.br/pinhais/institucional/nossos-cursos/cursos-superiores/gti/",
      "modalidade": "presencial",
      "situacao": "ativo",
      "escopo": "campus",
      "ppc": {
        "notion_page_id": "367f5b13-1dbd-81e3-9dc7-cf4770a39d8b",
        "url": "https://ifpr.edu.br/pinhais/wp-content/uploads/sites/22/2025/12/PPC_versao_atualizada.pdf",
        "conversao": {
          "status": "convertido"
        },
        "markdown_path": "institucional/ifpr/ppcs/pinhais/tecnologia-em-gestao-da-tecnologia-da-informacao.md",
        "metadados": {
          "ano_documento": {
            "ano": 2025,
            "trecho_fonte": "Ano do documento registrado no Notion: 2025",
            "status_curadoria": "precisa_revisao"
          },
          "vagas": {
            "quantidade": 40,
            "trecho_fonte": "Vagas totais (anual) 40 vagas",
            "status_curadoria": "precisa_revisao",
            "periodicidade": "anual"
          }
        }
      }
    }
  ]
}
